{
  "generator": "c2r.synth v1",
  "matrix": [
    [
      0,
      6,
      6,
      6,
      11,
      18,
      10,
      19,
      13,
      14,
      16,
      17,
      6,
      6,
      6,
      11,
      14,
      6,
      12,
      7,
      11,
      9,
      6,
      6,
      15,
      6,
      6,
      9,
      14,
      6,
      10,
      18,
      7,
      12,
      15,
      15,
      6,
      6,
      10,
      13
    ],
    [
      6,
      0,
      6,
      11,
      10,
      12,
      10,
      18,
      12,
      11,
      16,
      14,
      6,
      7,
      6,
      9,
      14,
      7,
      18,
      6,
      12,
      9,
      6,
      7,
      14,
      6,
      10,
      7,
      11,
      6,
      14,
      18,
      7,
      11,
      11,
      14,
      6,
      6,
      10,
      15
    ],
    [
      6,
      6,
      0,
      12,
      8,
      21,
      7,
      24,
      9,
      23,
      12,
      15,
      6,
      12,
      6,
      13,
      13,
      10,
      10,
      6,
      7,
      14,
      6,
      13,
      12,
      9,
      6,
      11,
      9,
      6,
      7,
      19,
      10,
      16,
      9,
      18,
      9,
      11,
      9,
      15
    ],
    [
      6,
      11,
      12,
      0,
      23,
      25,
      11,
      9,
      24,
      23,
      6,
      11,
      12,
      14,
      8,
      6,
      21,
      15,
      15,
      14,
      21,
      16,
      13,
      13,
      24,
      15,
      15,
      7,
      19,
      11,
      7,
      9,
      16,
      22,
      9,
      9,
      12,
      16,
      6,
      9
    ],
    [
      11,
      10,
      8,
      23,
      0,
      15,
      12,
      31,
      6,
      11,
      19,
      27,
      8,
      17,
      11,
      22,
      6,
      14,
      19,
      16,
      6,
      7,
      10,
      19,
      6,
      15,
      11,
      20,
      6,
      10,
      17,
      28,
      6,
      10,
      19,
      28,
      6,
      9,
      21,
      27
    ],
    [
      18,
      12,
      21,
      25,
      15,
      0,
      25,
      18,
      14,
      6,
      30,
      15,
      19,
      7,
      16,
      21,
      16,
      8,
      28,
      11,
      16,
      6,
      21,
      9,
      14,
      6,
      25,
      15,
      16,
      14,
      26,
      15,
      10,
      9,
      28,
      19,
      12,
      10,
      23,
      14
    ],
    [
      10,
      10,
      7,
      11,
      12,
      25,
      0,
      21,
      12,
      25,
      8,
      15,
      6,
      19,
      8,
      10,
      16,
      17,
      6,
      15,
      13,
      17,
      6,
      15,
      16,
      18,
      6,
      11,
      16,
      10,
      6,
      16,
      15,
      21,
      6,
      15,
      15,
      18,
      9,
      14
    ],
    [
      19,
      18,
      24,
      9,
      31,
      18,
      21,
      0,
      35,
      23,
      18,
      6,
      26,
      14,
      18,
      11,
      33,
      21,
      24,
      12,
      28,
      21,
      22,
      13,
      35,
      14,
      26,
      13,
      29,
      21,
      18,
      6,
      28,
      26,
      18,
      6,
      27,
      22,
      11,
      6
    ],
    [
      13,
      12,
      9,
      24,
      6,
      14,
      12,
      35,
      0,
      14,
      18,
      27,
      10,
      20,
      15,
      25,
      6,
      11,
      13,
      22,
      6,
      15,
      11,
      20,
      6,
      16,
      9,
      21,
      6,
      11,
      16,
      29,
      6,
      9,
      15,
      29,
      9,
      13,
      23,
      27
    ],
    [
      14,
      11,
      23,
      23,
      11,
      6,
      25,
      23,
      14,
      0,
      28,
      20,
      19,
      11,
      12,
      22,
      17,
      6,
      28,
      10,
      16,
      6,
      19,
      15,
      12,
      11,
      22,
      13,
      10,
      13,
      25,
      21,
      9,
      6,
      28,
      22,
      10,
      7,
      27,
      21
    ],
    [
      16,
      16,
      12,
      6,
      19,
      30,
      8,
      18,
      18,
      28,
      0,
      16,
      12,
      21,
      15,
      9,
      18,
      24,
      6,
      19,
      12,
      25,
      10,
      23,
      23,
      23,
      8,
      19,
      20,
      16,
      6,
      17,
      24,
      28,
      6,
      14,
      19,
      21,
      6,
      17
    ],
    [
      17,
      14,
      15,
      11,
      27,
      15,
      15,
      6,
      27,
      20,
      16,
      0,
      17,
      11,
      13,
      10,
      31,
      14,
      19,
      7,
      26,
      20,
      17,
      7,
      30,
      8,
      22,
      6,
      28,
      16,
      15,
      6,
      22,
      23,
      15,
      6,
      19,
      20,
      15,
      6
    ],
    [
      6,
      6,
      6,
      12,
      8,
      19,
      6,
      26,
      10,
      19,
      12,
      17,
      0,
      11,
      8,
      15,
      10,
      13,
      8,
      11,
      7,
      14,
      6,
      12,
      8,
      12,
      6,
      14,
      10,
      6,
      6,
      21,
      9,
      15,
      8,
      21,
      9,
      14,
      14,
      20
    ],
    [
      6,
      7,
      12,
      14,
      17,
      7,
      19,
      14,
      20,
      11,
      21,
      11,
      11,
      0,
      7,
      11,
      19,
      8,
      20,
      6,
      15,
      9,
      13,
      6,
      19,
      6,
      16,
      6,
      17,
      6,
      19,
      10,
      15,
      14,
      19,
      8,
      11,
      9,
      17,
      7
    ],
    [
      6,
      6,
      6,
      8,
      11,
      16,
      8,
      18,
      15,
      12,
      15,
      13,
      8,
      7,
      0,
      11,
      16,
      6,
      16,
      6,
      12,
      8,
      9,
      8,
      12,
      9,
      6,
      8,
      13,
      6,
      12,
      16,
      9,
      13,
      12,
      14,
      8,
      6,
      6,
      14
    ],
    [
      11,
      9,
      13,
      6,
      22,
      21,
      10,
      11,
      25,
      22,
      9,
      10,
      15,
      11,
      11,
      0,
      25,
      13,
      12,
      13,
      20,
      14,
      12,
      13,
      19,
      13,
      14,
      6,
      22,
      10,
      8,
      6,
      16,
      17,
      9,
      6,
      15,
      13,
      6,
      6
    ],
    [
      14,
      14,
      13,
      21,
      6,
      16,
      16,
      33,
      6,
      17,
      18,
      31,
      10,
      19,
      16,
      25,
      0,
      10,
      12,
      22,
      6,
      12,
      12,
      21,
      10,
      19,
      8,
      22,
      7,
      14,
      18,
      31,
      9,
      15,
      16,
      33,
      8,
      11,
      21,
      28
    ],
    [
      6,
      7,
      10,
      15,
      14,
      8,
      17,
      21,
      11,
      6,
      24,
      14,
      13,
      8,
      6,
      13,
      10,
      0,
      18,
      9,
      9,
      6,
      15,
      6,
      15,
      6,
      14,
      8,
      12,
      6,
      20,
      17,
      6,
      6,
      20,
      16,
      6,
      6,
      16,
      14
    ],
    [
      12,
      18,
      10,
      15,
      19,
      28,
      6,
      24,
      13,
      28,
      6,
      19,
      8,
      20,
      16,
      12,
      12,
      18,
      0,
      17,
      12,
      22,
      7,
      18,
      18,
      22,
      7,
      14,
      21,
      15,
      6,
      20,
      18,
      28,
      6,
      23,
      21,
      17,
      14,
      17
    ],
    [
      7,
      6,
      6,
      14,
      16,
      11,
      15,
      12,
      22,
      10,
      19,
      7,
      11,
      6,
      6,
      13,
      22,
      9,
      17,
      0,
      19,
      10,
      8,
      6,
      22,
      6,
      16,
      6,
      22,
      8,
      14,
      10,
      17,
      15,
      17,
      8,
      10,
      14,
      17,
      9
    ],
    [
      11,
      12,
      7,
      21,
      6,
      16,
      13,
      28,
      6,
      16,
      12,
      26,
      7,
      15,
      12,
      20,
      6,
      9,
      12,
      19,
      0,
      11,
      7,
      18,
      9,
      17,
      6,
      18,
      7,
      9,
      13,
      30,
      10,
      15,
      10,
      27,
      6,
      7,
      19,
      25
    ],
    [
      9,
      9,
      14,
      16,
      7,
      6,
      17,
      21,
      15,
      6,
      25,
      20,
      14,
      9,
      8,
      14,
      12,
      6,
      22,
      10,
      11,
      0,
      16,
      11,
      11,
      6,
      18,
      11,
      11,
      6,
      20,
      18,
      7,
      6,
      20,
      19,
      6,
      6,
      20,
      13
    ],
    [
      6,
      6,
      6,
      13,
      10,
      21,
      6,
      22,
      11,
      19,
      10,
      17,
      6,
      13,
      9,
      12,
      12,
      15,
      7,
      8,
      7,
      16,
      0,
      11,
      15,
      11,
      6,
      13,
      12,
      11,
      6,
      21,
      13,
      18,
      6,
      19,
      8,
      13,
      15,
      17
    ],
    [
      6,
      7,
      13,
      13,
      19,
      9,
      15,
      13,
      20,
      15,
      23,
      7,
      12,
      6,
      8,
      13,
      21,
      6,
      18,
      6,
      18,
      11,
      11,
      0,
      21,
      6,
      10,
      8,
      19,
      9,
      14,
      8,
      17,
      14,
      18,
      8,
      15,
      10,
      11,
      6
    ],
    [
      15,
      14,
      12,
      24,
      6,
      14,
      16,
      35,
      6,
      12,
      23,
      30,
      8,
      19,
      12,
      19,
      10,
      15,
      18,
      22,
      9,
      11,
      15,
      21,
      0,
      18,
      13,
      20,
      6,
      11,
      14,
      30,
      6,
      7,
      15,
      26,
      6,
      13,